{
  "schema_version": "0.1.0",
  "example_id": "RC-GRAPH-001",
  "note": "Grafo canônico do Risco Cognitivo (LANC-001 PR-G, ADR-M04). Fonte: RC-ART-P1-001, RC-ART-P3-001, RC-LP-001, RC-ART-MASTER-001, RC-SRC-001 (docs/lancamento/LANC-001/intake/DOCS-002), RC-SRC-002 (intake/RC-PUB-PACK-003: fontes científicas da série, PMIDs conferidos) e RC-HOME-002 (intake/HOME-002: os nós Memória de trabalho, Controle inibitório e Flexibilidade cognitiva, aprovados pelo OWNER no HOME-BRAIN-001). Relações não explícitas no texto são E_INFERRED + PROPOSED; eventos operacionais usam OPERATIONAL_IMPACT + tag stage:event (CF-16).",
  "nodes": [
    {
      "id": "FRC-EXCESSO-INFORMACAO",
      "type": "RISK_FACTOR",
      "label": "Excesso de informação",
      "status": "DEFINED",
      "source_refs": [
        "RC-ART-P1-001"
      ],
      "source_quote": "excesso de informação"
    },
    {
      "id": "FRC-INFORMACAO-MAL-ORGANIZADA",
      "type": "RISK_FACTOR",
      "label": "Informação mal organizada",
      "status": "DEFINED",
      "source_refs": [
        "RC-ART-P1-001"
      ],
      "source_quote": "informação mal organizada"
    },
    {
      "id": "FRC-TAREFA-AMBIGUA",
      "type": "RISK_FACTOR",
      "label": "Tarefa ambígua",
      "status": "DEFINED",
      "source_refs": [
        "RC-ART-P1-001"
      ],
      "source_quote": "tarefa ambígua"
    },
    {
      "id": "FRC-FALTA-DECOMPOSICAO",
      "type": "RISK_FACTOR",
      "label": "Falta de decomposição",
      "status": "DEFINED",
      "source_refs": [
        "RC-ART-P1-001"
      ],
      "source_quote": "falta de decomposição"
    },
    {
      "id": "FRC-DEPENDENCIAS-OCULTAS",
      "type": "RISK_FACTOR",
      "label": "Dependências ocultas",
      "status": "DEFINED",
      "source_refs": [
        "RC-ART-P1-001"
      ],
      "source_quote": "dependências ocultas"
    },
    {
      "id": "FRC-INTERRUPCOES",
      "type": "RISK_FACTOR",
      "label": "Interrupções",
      "status": "DEFINED",
      "source_refs": [
        "RC-ART-P1-001"
      ],
      "source_quote": "interrupções"
    },
    {
      "id": "FRC-DEPENDENCIA-MEMORIA",
      "type": "RISK_FACTOR",
      "label": "Dependência de memória",
      "status": "DEFINED",
      "source_refs": [
        "RC-ART-P1-001"
      ],
      "source_quote": "dependência de memória"
    },
    {
      "id": "FRC-AMBIENTE-FRAGMENTADO",
      "type": "RISK_FACTOR",
      "label": "Ambiente digital fragmentado",
      "status": "DEFINED",
      "source_refs": [
        "RC-ART-P1-001"
      ],
      "source_quote": "ambiente digital fragmentado"
    },
    {
      "id": "FRC-SOBRECARGA",
      "type": "RISK_FACTOR",
      "label": "Sobrecarga",
      "status": "DEFINED",
      "source_refs": [
        "RC-LP-001",
        "RC-ART-MASTER-001"
      ],
      "source_quote": "sobrecarga"
    },
    {
      "id": "FRC-MUITAS-OPCOES",
      "type": "RISK_FACTOR",
      "label": "Muitas opções",
      "status": "DEFINED",
      "source_refs": [
        "RC-ART-P3-001"
      ],
      "source_quote": "Problema: muitas opções."
    },
    {
      "id": "FRC-ACAO-REPETITIVA",
      "type": "RISK_FACTOR",
      "label": "Ação repetitiva",
      "status": "DEFINED",
      "source_refs": [
        "RC-ART-P3-001"
      ],
      "source_quote": "Problema: ação repetitiva."
    },
    {
      "id": "COG-ATENCAO",
      "type": "COGNITIVE_CAPACITY",
      "label": "Atenção",
      "status": "DEFINED",
      "source_refs": [
        "RC-ART-P1-001"
      ],
      "source_quote": "atenção"
    },
    {
      "id": "COG-MEMORIA",
      "type": "COGNITIVE_CAPACITY",
      "label": "Memória",
      "status": "DEFINED",
      "source_refs": [
        "RC-ART-P1-001"
      ],
      "source_quote": "memória"
    },
    {
      "id": "COG-PLANEJAMENTO",
      "type": "COGNITIVE_CAPACITY",
      "label": "Planejamento",
      "status": "DEFINED",
      "source_refs": [
        "RC-ART-P1-001"
      ],
      "source_quote": "planejamento"
    },
    {
      "id": "COG-PRIORIZACAO",
      "type": "COGNITIVE_CAPACITY",
      "label": "Priorização",
      "status": "DEFINED",
      "source_refs": [
        "RC-ART-P1-001"
      ],
      "source_quote": "priorização"
    },
    {
      "id": "COG-DECISAO",
      "type": "COGNITIVE_CAPACITY",
      "label": "Tomada de decisão",
      "status": "DEFINED",
      "source_refs": [
        "RC-ART-P1-001"
      ],
      "source_quote": "tomada de decisão"
    },
    {
      "id": "COG-MONITORAMENTO",
      "type": "COGNITIVE_CAPACITY",
      "label": "Monitoramento",
      "status": "DEFINED",
      "source_refs": [
        "RC-ART-P1-001"
      ],
      "source_quote": "monitoramento"
    },
    {
      "id": "COG-ALTERNANCIA-CONTEXTO",
      "type": "COGNITIVE_CAPACITY",
      "label": "Alternância de contexto",
      "status": "DEFINED",
      "source_refs": [
        "RC-ART-P1-001"
      ],
      "source_quote": "alternância de contexto"
    },
    {
      "id": "COG-INTERPRETACAO",
      "type": "COGNITIVE_CAPACITY",
      "label": "Interpretação",
      "status": "DEFINED",
      "source_refs": [
        "RC-ART-P1-001"
      ],
      "source_quote": "interpretação"
    },
    {
      "id": "COG-INICIACAO",
      "type": "COGNITIVE_CAPACITY",
      "label": "Iniciação",
      "status": "DEFINED",
      "source_refs": [
        "RC-ART-P1-001"
      ],
      "source_quote": "iniciação"
    },
    {
      "id": "COG-MEMORIA-TRABALHO",
      "type": "COGNITIVE_CAPACITY",
      "label": "Memória de trabalho",
      "status": "DRAFT",
      "source_refs": [
        "RC-HOME-002"
      ],
      "source_quote": "Memória de trabalho: Mantém e manipula informações no curto prazo."
    },
    {
      "id": "COG-CONTROLE-INIBITORIO",
      "type": "COGNITIVE_CAPACITY",
      "label": "Controle inibitório",
      "status": "DRAFT",
      "source_refs": [
        "RC-HOME-002"
      ],
      "source_quote": "Controle inibitório: Ajuda a focar e evitar distrações."
    },
    {
      "id": "COG-FLEXIBILIDADE",
      "type": "COGNITIVE_CAPACITY",
      "label": "Flexibilidade cognitiva",
      "status": "DRAFT",
      "source_refs": [
        "RC-HOME-002"
      ],
      "source_quote": "Flexibilidade cognitiva: Permite adaptar estratégias e lidar com mudanças."
    },
    {
      "id": "EVT-PERDA-CONTEXTO",
      "type": "OPERATIONAL_IMPACT",
      "label": "Perda de contexto",
      "status": "DEFINED",
      "source_refs": [
        "RC-ART-P1-001",
        "RC-ART-P3-001"
      ],
      "source_quote": "Problema: perder contexto.",
      "tags": [
        "stage:event"
      ]
    },
    {
      "id": "EVT-ETAPA-ESQUECIDA",
      "type": "OPERATIONAL_IMPACT",
      "label": "Etapa esquecida",
      "status": "DEFINED",
      "source_refs": [
        "RC-ART-P1-001",
        "RC-ART-P3-001"
      ],
      "source_quote": "Problema: esquecer uma etapa.",
      "tags": [
        "stage:event"
      ]
    },
    {
      "id": "EVT-NAO-SABER-COMECAR",
      "type": "OPERATIONAL_IMPACT",
      "label": "Não saber começar",
      "status": "DEFINED",
      "source_refs": [
        "RC-ART-P3-001"
      ],
      "source_quote": "Problema: não saber começar.",
      "tags": [
        "stage:event"
      ]
    },
    {
      "id": "EVT-ERRO",
      "type": "OPERATIONAL_IMPACT",
      "label": "Erro",
      "status": "DEFINED",
      "source_refs": [
        "RC-ART-P1-001"
      ],
      "source_quote": "atraso, erro, retrabalho, omissão, abandono ou baixa qualidade",
      "tags": [
        "stage:event"
      ]
    },
    {
      "id": "EVT-OMISSAO",
      "type": "OPERATIONAL_IMPACT",
      "label": "Omissão",
      "status": "DEFINED",
      "source_refs": [
        "RC-ART-P1-001"
      ],
      "source_quote": "atraso, erro, retrabalho, omissão, abandono ou baixa qualidade",
      "tags": [
        "stage:event"
      ]
    },
    {
      "id": "IMP-ATRASO",
      "type": "OPERATIONAL_IMPACT",
      "label": "Atraso",
      "status": "DEFINED",
      "source_refs": [
        "RC-ART-P1-001"
      ],
      "source_quote": "atraso, erro, retrabalho, omissão, abandono ou baixa qualidade",
      "tags": [
        "stage:impact"
      ]
    },
    {
      "id": "IMP-RETRABALHO",
      "type": "OPERATIONAL_IMPACT",
      "label": "Retrabalho",
      "status": "DEFINED",
      "source_refs": [
        "RC-ART-P1-001"
      ],
      "source_quote": "atraso, erro, retrabalho, omissão, abandono ou baixa qualidade",
      "tags": [
        "stage:impact"
      ]
    },
    {
      "id": "IMP-ABANDONO",
      "type": "OPERATIONAL_IMPACT",
      "label": "Abandono",
      "status": "DEFINED",
      "source_refs": [
        "RC-ART-P1-001"
      ],
      "source_quote": "atraso, erro, retrabalho, omissão, abandono ou baixa qualidade",
      "tags": [
        "stage:impact"
      ]
    },
    {
      "id": "IMP-BAIXA-QUALIDADE",
      "type": "OPERATIONAL_IMPACT",
      "label": "Baixa qualidade",
      "status": "DEFINED",
      "source_refs": [
        "RC-ART-P1-001"
      ],
      "source_quote": "atraso, erro, retrabalho, omissão, abandono ou baixa qualidade",
      "tags": [
        "stage:impact"
      ]
    },
    {
      "id": "CMP-EXTERNALIZACAO",
      "type": "COMPENSATION",
      "label": "Externalização",
      "status": "DEFINED",
      "source_refs": [
        "RC-ART-P3-001"
      ],
      "source_quote": "Move informação da memória para o ambiente."
    },
    {
      "id": "CMP-REDUCAO",
      "type": "COMPENSATION",
      "label": "Redução",
      "status": "DEFINED",
      "source_refs": [
        "RC-ART-P3-001"
      ],
      "source_quote": "Retira elementos que não precisam competir pela atenção."
    },
    {
      "id": "CMP-EXPLICITACAO",
      "type": "COMPENSATION",
      "label": "Explicitação",
      "status": "DEFINED",
      "source_refs": [
        "RC-ART-P3-001"
      ],
      "source_quote": "Transforma informação implícita em informação visível."
    },
    {